{
  "schema_version": "1.0.0",
  "project_id": "community-river-engineering-template",
  "stages": [
    {
      "id": "authoritative_terrain",
      "status": "provisional",
      "evidence_ids": [
        "USGS-3DEP-or-equivalent"
      ],
      "blocking_reasons": [
        "Project-specific AOI and acquisition record must be attached."
      ],
      "depends_on": [],
      "preconditions": {
        "required_artifact_classes": [
          "terrain_surface",
          "acquisition_record"
        ],
        "required_crs": "EPSG:2966",
        "required_datum": "NAVD88",
        "required_reviewers": []
      }
    },
    {
      "id": "verified_bathymetry",
      "status": "blocked",
      "evidence_ids": [],
      "blocking_reasons": [
        "Surveyed/topobathymetric channel evidence is required before submerged-channel modeling."
      ],
      "depends_on": [
        "authoritative_terrain"
      ],
      "preconditions": {
        "required_artifact_classes": [
          "surveyed_channel_bathymetry",
          "topobathymetry"
        ],
        "required_crs": "EPSG:2966",
        "required_datum": "NAVD88",
        "required_reviewers": []
      }
    },
    {
      "id": "datum_control",
      "status": "blocked",
      "evidence_ids": [],
      "blocking_reasons": [
        "Horizontal/vertical control and transformation record not yet attached."
      ],
      "depends_on": [
        "verified_bathymetry"
      ],
      "preconditions": {
        "required_artifact_classes": [
          "geodetic_control_record",
          "datum_transformation_record"
        ],
        "required_crs": "EPSG:2966",
        "required_datum": "NAVD88",
        "required_reviewers": []
      }
    },
    {
      "id": "baseline_hec_ras",
      "status": "blocked",
      "evidence_ids": [],
      "blocking_reasons": [
        "Depends on terrain, bathymetry and datum control."
      ],
      "depends_on": [
        "datum_control",
        "authoritative_terrain",
        "verified_bathymetry"
      ],
      "preconditions": {
        "required_artifact_classes": [
          "hydraulic_model_project"
        ],
        "required_crs": "EPSG:2966",
        "required_datum": "NAVD88",
        "required_reviewers": []
      }
    },
    {
      "id": "calibrated_hydraulics",
      "status": "blocked",
      "evidence_ids": [],
      "blocking_reasons": [
        "Observed calibration/validation evidence required."
      ],
      "depends_on": [
        "baseline_hec_ras"
      ],
      "preconditions": {
        "required_artifact_classes": [
          "observed_hydrology",
          "calibration_evidence",
          "validation_evidence"
        ],
        "required_crs": null,
        "required_datum": null,
        "required_reviewers": []
      }
    },
    {
      "id": "alternative_scenarios",
      "status": "blocked",
      "evidence_ids": [],
      "blocking_reasons": [
        "Baseline must pass first."
      ],
      "depends_on": [
        "calibrated_hydraulics"
      ],
      "preconditions": {
        "required_artifact_classes": [
          "scenario_model_output"
        ],
        "required_crs": "EPSG:2966",
        "required_datum": "NAVD88",
        "required_reviewers": []
      }
    },
    {
      "id": "independent_earthwork",
      "status": "blocked",
      "evidence_ids": [],
      "blocking_reasons": [
        "Identical-grid baseline/proposed surfaces and exact footprint masks required."
      ],
      "depends_on": [
        "alternative_scenarios"
      ],
      "preconditions": {
        "required_artifact_classes": [
          "baseline_surface",
          "proposed_surface",
          "footprint_mask"
        ],
        "required_crs": "EPSG:2966",
        "required_datum": "NAVD88",
        "required_reviewers": []
      }
    },
    {
      "id": "sediment_suitability",
      "status": "blocked",
      "evidence_ids": [],
      "blocking_reasons": [
        "Geotechnical and environmental laboratory evidence required."
      ],
      "depends_on": [
        "independent_earthwork"
      ],
      "preconditions": {
        "required_artifact_classes": [
          "geotechnical_laboratory_evidence",
          "environmental_laboratory_evidence"
        ],
        "required_crs": null,
        "required_datum": null,
        "required_reviewers": []
      }
    },
    {
      "id": "environmental_screening",
      "status": "blocked",
      "evidence_ids": [],
      "blocking_reasons": [
        "Current agency screening and critical-habitat review required."
      ],
      "depends_on": [
        "sediment_suitability"
      ],
      "preconditions": {
        "required_artifact_classes": [
          "agency_screening_record"
        ],
        "required_crs": null,
        "required_datum": null,
        "required_reviewers": []
      }
    },
    {
      "id": "agency_eligibility",
      "status": "blocked",
      "evidence_ids": [],
      "blocking_reasons": [
        "Agency determination cannot be inferred from model output."
      ],
      "depends_on": [
        "environmental_screening"
      ],
      "preconditions": {
        "required_artifact_classes": [
          "agency_determination_record"
        ],
        "required_crs": null,
        "required_datum": null,
        "required_reviewers": [
          "determining_agency"
        ]
      }
    },
    {
      "id": "benefit_cost_analysis",
      "status": "blocked",
      "evidence_ids": [],
      "blocking_reasons": [
        "Program-specific BCA inputs and methodology required."
      ],
      "depends_on": [
        "agency_eligibility"
      ],
      "preconditions": {
        "required_artifact_classes": [
          "bca_inputs",
          "bca_methodology_record"
        ],
        "required_crs": null,
        "required_datum": null,
        "required_reviewers": []
      }
    },
    {
      "id": "funding_application",
      "status": "blocked",
      "evidence_ids": [],
      "blocking_reasons": [
        "Eligibility, match, allowable costs and current solicitation must be verified."
      ],
      "depends_on": [
        "benefit_cost_analysis"
      ],
      "preconditions": {
        "required_artifact_classes": [
          "funding_application_package"
        ],
        "required_crs": null,
        "required_datum": null,
        "required_reviewers": []
      }
    },
    {
      "id": "qa_qc",
      "status": "blocked",
      "evidence_ids": [],
      "blocking_reasons": [
        "Independent reproduction and final review required."
      ],
      "depends_on": [
        "funding_application"
      ],
      "preconditions": {
        "required_artifact_classes": [
          "independent_reproduction_evidence",
          "evidence_manifest"
        ],
        "required_crs": null,
        "required_datum": null,
        "required_reviewers": [
          "independent_reviewer"
        ]
      }
    }
  ],
  "controls": {
    "no_downstream_without_upstream": true,
    "bathymetry_required_for_submerged_channel": true,
    "datum_must_be_explicit": true,
    "earthwork_must_be_independent": true,
    "sediment_not_structural_fill_by_default": true,
    "agency_eligibility_is_not_inferred": true,
    "funding_is_not_an_award": true,
    "human_engineering_review_required": true
  },
  "terminal_stages": [
    "qa_qc"
  ],
  "evaluation": {
    "evaluated_by": "scripts/ci/validate-engineering-pipeline.mjs",
    "declarative_limits": "This JSON declares stage order, gate preconditions and fail-closed controls; it does not execute transitions. Enforcement lives in the pipeline runner / CI validator code.",
    "transition_rule": "Stage statuses advance not_started|blocked -> provisional -> verified -> approved. A downstream stage in the canonical order may not carry a status rank higher than any upstream stage it depends on (rank: not_started=0, blocked=0, provisional=1, verified=2, approved=3); violations fail the build."
  }
}
